{
  "schemaVersion": 1,
  "deliveryId": "delivery-2026-07-24-seaside-travel-r1",
  "lifePackId": "life-2026-07-24-seaside-travel",
  "date": "2026-07-24",
  "planRevision": 1,
  "deliveryRevision": 1,
  "createdAt": "2026-07-24T18:00:00+08:00",
  "degraded": false,
  "videos": [
    {
      "sortOrder": 1,
      "slot": "morning",
      "episodeId": "ep-2026-07-24-travel-morning",
      "title": "它们在海边等到第一束光",
      "fileName": "01-morning.mp4",
      "relativePath": "./01-morning.mp4",
      "sha256": "1111111111111111111111111111111111111111111111111111111111111111",
      "byteSize": 12345678,
      "durationMs": 10000,
      "container": "mp4",
      "videoCodec": "h264",
      "audioCodec": "aac",
      "width": 720,
      "height": 1280,
      "hasAudio": true,
      "renderRevision": 1,
      "selectedVariant": "primary",
      "qcStatus": "passed"
    },
    {
      "sortOrder": 2,
      "slot": "noon",
      "episodeId": "ep-2026-07-24-travel-noon",
      "title": "市集里的水果自己滚走了",
      "fileName": "02-noon.mp4",
      "relativePath": "./02-noon.mp4",
      "sha256": "2222222222222222222222222222222222222222222222222222222222222222",
      "byteSize": 12456789,
      "durationMs": 10000,
      "container": "mp4",
      "videoCodec": "h264",
      "audioCodec": "aac",
      "width": 720,
      "height": 1280,
      "hasAudio": true,
      "renderRevision": 1,
      "selectedVariant": "primary",
      "qcStatus": "passed"
    },
    {
      "sortOrder": 3,
      "slot": "evening",
      "episodeId": "ep-2026-07-24-travel-evening",
      "title": "缆车升到城市灯光上方",
      "fileName": "03-evening.mp4",
      "relativePath": "./03-evening.mp4",
      "sha256": "3333333333333333333333333333333333333333333333333333333333333333",
      "byteSize": 12567890,
      "durationMs": 10000,
      "container": "mp4",
      "videoCodec": "h264",
      "audioCodec": "aac",
      "width": 720,
      "height": 1280,
      "hasAudio": true,
      "renderRevision": 1,
      "selectedVariant": "primary",
      "qcStatus": "passed"
    }
  ]
}
